<!ELEMENT cv (etatcivil, formation+, experience*)>
<!ELEMENT etatcivil (nom, prenom, age, lien)>
<!ELEMENT formation (titre, data, mention?, description?)>
<!ELEMENT experience (libelle, fonction, annee, observation?)>
<!ELEMENT nom (#PCDATA)>
<!ELEMENT prenom (#PCDATA)>
<!ELEMENT age (#PCDATA)>
<!ELEMENT lien (#PCDATA)>
<!ELEMENT data (#PCDATA)>
<!ELEMENT annee (#PCDATA)>
<!ELEMENT titre (#PCDATA)>
<!ELEMENT libelle (#PCDATA)>
<!ELEMENT mention (#PCDATA)>
<!ELEMENT fonction (#PCDATA)>
<!ELEMENT description (#PCDATA)>
<!ELEMENT observation (#PCDATA)>